{
  "esquema": "escena-texto@1",
  "id": "CAP-02/ESC-02",
  "escena_plan": "CAP-02/ESC-02",
  "texto_ref": "etapa-3/capitulos/cap-02/esc-02.i1.md",
  "intento": 1,
  "estado": "Aprobada",
  "palabras_estimadas": 45,
  "palabras_objetivo": 45,
  "autoria": "agente",
  "veredicto_ref": "bitacora/e3-cap-02.jsonl#secuencia:218"
}